{
  "benchmark_performance": {
    "average_capture_ratio": null,
    "max_drawdown_pct": null,
    "net_realized_pnl_usd": -6.612679540113009,
    "net_realized_return_pct": -0.26450718160452036,
    "realized_pnl_usd": -0.4920695900000095,
    "realized_return_pct": -0.019682783600000378,
    "win_rate_pct": null
  },
  "cost_model_id": "execution_costs_v1.0",
  "execution_policy_review": [
    {
      "cohort_summaries": {
        "SCOUT_SELECTION": {
          "average_capture_ratio": -0.131405523338349,
          "delta_vs_champion": {
            "capture_ratio": null,
            "return_pct": null
          },
          "exit_reason_counts": {
            "ENTRY_REJECTED": {},
            "PROFIT_TARGET": 0,
            "SESSION_END": 0,
            "TRAILING_STOP": 2
          },
          "gross_realized_pnl_usd": -8.19660000000003,
          "max_drawdown_pct": -2.207792207792214,
          "net_average_capture_ratio": -2.8910942556178467,
          "net_realized_pnl_usd": -17.53538590000003,
          "net_realized_return_pct": -1.7845928057091456,
          "realized_pnl_usd": -8.19660000000003,
          "realized_return_pct": -0.8366336633663398,
          "trades_executed": 2,
          "win_rate_pct": 0.0
        },
        "TOP_10_MOVER": {
          "average_capture_ratio": 0.09369654203289926,
          "delta_vs_champion": {
            "capture_ratio": null,
            "return_pct": null
          },
          "exit_reason_counts": {
            "ENTRY_REJECTED": {},
            "PROFIT_TARGET": 0,
            "SESSION_END": 0,
            "TRAILING_STOP": 5
          },
          "gross_realized_pnl_usd": 50.08745799999995,
          "max_drawdown_pct": -2.220264317180609,
          "net_average_capture_ratio": 0.019823607399995613,
          "net_realized_pnl_usd": 10.532665729999948,
          "net_realized_return_pct": 0.4162006721676403,
          "realized_pnl_usd": 50.08745799999995,
          "realized_return_pct": 2.0036663249079325,
          "trades_executed": 5,
          "win_rate_pct": 40.0
        }
      },
      "exit_mode": "PERCENT",
      "policy_id": "execution_policy_v1.0",
      "sizing_mode": "FIXED_FRACTION"
    },
    {
      "cohort_summaries": {
        "SCOUT_SELECTION": {
          "average_capture_ratio": -0.30519903854919955,
          "delta_vs_champion": {
            "capture_ratio": -0.17379351521085054,
            "return_pct": 1.1276627662766292
          },
          "exit_reason_counts": {
            "ENTRY_REJECTED": {},
            "PROFIT_TARGET": 0,
            "SESSION_END": 2,
            "TRAILING_STOP": 0
          },
          "gross_realized_pnl_usd": -6.779999999999995,
          "max_drawdown_pct": -8.441558441558449,
          "net_average_capture_ratio": -4.386544943820018,
          "net_realized_pnl_usd": -9.647493999999995,
          "net_realized_return_pct": -0.3451909905276258,
          "realized_pnl_usd": -6.779999999999995,
          "realized_return_pct": 0.2910291029102894,
          "trades_executed": 2,
          "win_rate_pct": 50.0
        },
        "TOP_10_MOVER": {
          "average_capture_ratio": 0.7306311003631013,
          "delta_vs_champion": {
            "capture_ratio": 0.6369345583302021,
            "return_pct": 14.257715351638225
          },
          "exit_reason_counts": {
            "ENTRY_REJECTED": {
              "MAX_POSITIONS_REACHED": 5
            },
            "PROFIT_TARGET": 0,
            "SESSION_END": 5,
            "TRAILING_STOP": 0
          },
          "gross_realized_pnl_usd": 159.24940000000007,
          "max_drawdown_pct": -2.385532897268172,
          "net_average_capture_ratio": 0.7269791255274701,
          "net_realized_pnl_usd": 147.39903900000007,
          "net_realized_return_pct": 15.015099627719469,
          "realized_pnl_usd": 159.24940000000007,
          "realized_return_pct": 16.261381676546158,
          "trades_executed": 5,
          "win_rate_pct": 100.0
        }
      },
      "exit_mode": "ATR",
      "policy_id": "execution_policy_atr_v1.0",
      "sizing_mode": "RISK_PER_TRADE"
    }
  ],
  "execution_policy_verdict": {
    "best_challenger_policy_id": "execution_policy_atr_v1.0",
    "challenger_won_on_movers": true,
    "challenger_won_on_selection": true,
    "champion_policy_id": "execution_policy_v1.0",
    "sample_size": {
      "SCOUT_SELECTION": 2,
      "TOP_10_MOVER": 10
    }
  },
  "execution_policy_version": "execution_policy_v1.0_hypothetical",
  "feature_failures": [
    {
      "description": "A visible benchmark mover remained below the research selection threshold.",
      "evidence": [
        "SPCE score=18.42%"
      ],
      "failure_type": "THRESHOLD",
      "feature_id": "selection_threshold"
    }
  ],
  "feature_proposals": [],
  "massive_plan": {
    "flat_files": true,
    "history_years": 10,
    "plan": "DEVELOPER",
    "rest_calls_per_minute": null
  },
  "missed_opportunities": [
    {
      "alpha12_score_pct": 8.333333333333332,
      "alpha12_total_score": 4,
      "benchmark_rank": 1,
      "component_scores": [
        {
          "calculation_version": "research_alpha_extended_v1.0",
          "metric_id": "atr_pct_opportunity",
          "raw_value": 13.310930255828692,
          "score": 4,
          "status": "SCORED"
        },
        {
          "calculation_version": "research_alpha_extended_v1.0",
          "metric_id": "average_daily_dollar_volume_quality",
          "raw_value": 23204786.99501,
          "score": 2,
          "status": "SCORED"
        },
        {
          "calculation_version": "research_alpha_extended_v1.0",
          "metric_id": "current_range_pct_opportunity",
          "raw_value": 6.1639038057436455,
          "score": 2,
          "status": "SCORED"
        },
        {
          "calculation_version": "research_alpha_extended_v1.0",
          "metric_id": "premarket_dollar_volume_quality",
          "raw_value": 340077.55713333335,
          "score": 1,
          "status": "SCORED"
        },
        {
          "calculation_version": "research_alpha_price_volume_v1.0",
          "metric_id": "premarket_gap_strength",
          "raw_value": 5.0665421433574584,
          "score": 3,
          "status": "OBSERVED"
        },
        {
          "calculation_version": "research_alpha_price_volume_v1.0",
          "metric_id": "premarket_range_expansion",
          "raw_value": {
            "average_daily_range_pct": 9.763655861985235,
            "expansion_ratio": 0.6313110470989444,
            "premarket_range_pct": 6.1639038057436455
          },
          "score": 0,
          "status": "OBSERVED"
        },
        {
          "calculation_version": "research_alpha_price_volume_v1.0",
          "metric_id": "premarket_trend_consistency",
          "raw_value": 41.52542372881356,
          "score": 0,
          "status": "OBSERVED"
        },
        {
          "calculation_version": "research_alpha_price_volume_v1.0",
          "metric_id": "price_slope_15m",
          "raw_value": -0.07046738886293653,
          "score": 0,
          "status": "OBSERVED"
        },
        {
          "calculation_version": "research_alpha_price_volume_v1.0",
          "metric_id": "price_slope_30m",
          "raw_value": 0.02051779157660918,
          "score": 1,
          "status": "OBSERVED"
        },
        {
          "calculation_version": "research_alpha_price_volume_v1.0",
          "metric_id": "price_slope_60m",
          "raw_value": -0.002405084265298254,
          "score": 0,
          "status": "OBSERVED"
        },
        {
          "calculation_version": "research_alpha_price_volume_v1.0",
          "metric_id": "price_volume_confirmation",
          "raw_value": {
            "aligned_positive_windows": 0,
            "short_term_override": false
          },
          "score": 0,
          "status": "OBSERVED"
        },
        {
          "calculation_version": "research_alpha_price_volume_v1.0",
          "metric_id": "price_vs_premarket_vwap",
          "raw_value": {
            "price_vs_vwap_pct": 0.12730709733277434,
            "vwap": 0.8988556929081483
          },
          "score": 0,
          "status": "OBSERVED"
        },
        {
          "calculation_version": "rsi_cutler_window_v1.0",
          "metric_id": "relative_strength_index_15m",
          "raw_value": 38.86792452830184,
          "score": 0,
          "status": "SCORED"
        },
        {
          "calculation_version": "rsi_cutler_window_v1.0",
          "metric_id": "relative_strength_index_30m",
          "raw_value": 50.0,
          "score": 1,
          "status": "SCORED"
        },
        {
          "calculation_version": "rsi_cutler_window_v1.0",
          "metric_id": "relative_strength_index_60m",
          "raw_value": 47.984267453294,
          "score": 0,
          "status": "SCORED"
        },
        {
          "calculation_version": "research_alpha_relative_volume_v1.0",
          "metric_id": "relative_volume",
          "raw_value": 0.5662397799365732,
          "score": 0,
          "status": "OBSERVED"
        },
        {
          "calculation_version": "research_alpha_price_volume_v1.0",
          "metric_id": "volume_slope_15m",
          "raw_value": -3.701635933876656,
          "score": 0,
          "status": "OBSERVED"
        },
        {
          "calculation_version": "research_alpha_price_volume_v1.0",
          "metric_id": "volume_slope_30m",
          "raw_value": -1.410077288747123,
          "score": 0,
          "status": "OBSERVED"
        },
        {
          "calculation_version": "research_alpha_price_volume_v1.0",
          "metric_id": "volume_slope_60m",
          "raw_value": 0.1349654955598872,
          "score": 0,
          "status": "OBSERVED"
        }
      ],
      "failure_reason_codes": [
        "BELOW_RESEARCH_THRESHOLD"
      ],
      "maximum_capturable_move_pct": 28.764975926547965,